{
  "title": "Healing After Divorce",
  "tag": "Marriage Restoration",
  "desc": "A compassionate guide for those walking through separation or divorce — offering biblical comfort, practical steps toward healing, and hope for restoration.",
  "pages": "22 pages",
  "size": "1.0 MB",
  "url": "#",
  "order": 5
}
