{
  "title": "The Leader's Devotional Journal",
  "tag": "Leadership",
  "desc": "A 21-day guided journal for Christian leaders — daily Scripture, reflections, and action points to sharpen your vision, character, and effectiveness.",
  "pages": "48 pages",
  "size": "2.1 MB",
  "url": "#",
  "order": 2
}
