{
  "title": "7 Pillars of a Godly Marriage",
  "tag": "Marriage",
  "desc": "A practical study guide covering the seven essential pillars that every Christian marriage must be built upon — from communication to covenant faithfulness.",
  "pages": "24 pages",
  "size": "1.2 MB",
  "url": "#",
  "order": 1
}
