{
  "title": "Youth Identity & Purpose Workbook",
  "tag": "Youth Empowerment",
  "desc": "An interactive workbook helping young people discover their God-given identity, gifts, and purpose — ideal for youth groups and personal study.",
  "pages": "36 pages",
  "size": "1.8 MB",
  "url": "#",
  "order": 4
}
