{
  "title": "Kingdom Finances: God's Principles",
  "tag": "Christian Living",
  "desc": "Discover God's principles for handling money with wisdom, integrity, and generosity — moving from financial struggle to stewardship and kingdom impact.",
  "pages": "30 pages",
  "size": "1.5 MB",
  "url": "#",
  "order": 6
}
