{
  "title": "Prayer Guide for Spiritual Revival",
  "tag": "Spiritual Awakening",
  "desc": "A structured 14-day prayer guide designed to ignite personal and corporate revival — with targeted Scripture prayers for families, churches, and communities.",
  "pages": "18 pages",
  "size": "900 KB",
  "url": "#",
  "order": 3
}
